"IDMonument","MonNumber","MonName","IDMonType","IDState","IDRegion","MonDescription","MonLength","MonWide","MonSquare","MonLayer","IDSquareType","IDSoilType","IDWaterType","IDRiverReliefType","IDLocalReliefForm","MonDateToTheFort","IDArrangementType","FerrousMetallurgy","NonferrousMetallurgy","Agriculture","IDMapNumber","IDCurrentState","Active","Location Specified","MonTatarCodeNumber","IDMonCultureBelonging","AnotherCultureLayers","MonDecimalLatitude","MonDecimalLongitude","MonLatitude","MonLongitude"
"1175","353","Тавлинское","1","3","20","В 300 м к С от села на стрелке коренной террасы. Площадка состоит из трех частей: северная, треугольной формы - 4 600 кв. м; юго-восточная (800 кв. м), которая прерывается с юго-востока ложбиной; за ней третья площадка - 1 400 кв. м. С северной стороны городище ограничено двумя валами с проездом и рвом между ними. Валы высотой 0,4-1,2 м, ров глубиной 1,8 м. Основная площадка городища с юга отделена рвом (глубина 0,7 м) с проездом по середине.
55,6503
48,2787",,,"6800","65","2",,"2","5","5","false","4","false","false","false","129",,"true","true","1713","560","560","55.6503","48.2787"," 55° 39' 1"""," 48° 16' 43"""
"1176","385","Тамьянское I","2","3","29","В обрыве коренной террасы, в С части д. Тамьян (л.б.р. Ик).",,,,,,,"2","1","1","false","4","false","false","false","138",,"true","false",,"561","561","55.370155556","53.069983333"," 55° 22' 13"""," 53° 4' 12"""
"1177","341","Танайка","1","3","88","На С окраине с. Танайка.",,,,,,,"2","5","5","false","4","false","false","false","124",,"true","false",,"562","562","55.747266667","51.922002778"," 55° 44' 50"""," 51° 55' 19"""
"1178","128","Танкеевское I","2","3","90","В д. Танкеевка (на месте Танкеевского могильника, Б.д.), на левом берегу ручья Старая Рытвина, правого притока р. Утки, левого притока Волги. [В Археологической карте Татарской АССР - Танкеевское селище 1а.]",,,,,,,"3","3","3","false","3","false","false","false","150",,"true","false",,"563","563","54.822497222","49.108602778"," 54° 49' 21"""," 49° 6' 31"""
"1179","129","Танкеевское II","2","3","90","В 0,4 км к З от д. Танкеевка, на левом берегу ручья Старая Рытвина, на краю распаханной надлуговой террасы.","150","100","15000",,"3",,"3","3","3","false","3","false","false","false","150",,"true","false",,"564","564","54.828380556","49.104827778"," 54° 49' 42"""," 49° 6' 17"""
"1180","114","Тарасова Пристань","1","3","26","К ЮЗ от пристани Тарасовой (пр.б.р. Камы), на одном из мысов.","45","40","1800","40","2",,"2","7","5","false","4","false","false","false","134",,"true","false",,"565","565","55.492725","50.811430556"," 55° 29' 34"""," 50° 48' 41"""
"1181","230","Татсунчелеевское","1","3","3","В 0,5 км к С от с. Татарское Сунчелеево, на высоком мысу коренного правого берега реки, в урочище ""Кыз-кала"".",,,"2800","65","2",,"2","7","1","false","2","false","false","false","153",,"true","true",,"566","566","54.724538889","50.735941667"," 54° 43' 28"""," 50° 44' 9"""
"1182","231","Татсунчелеевское I","2","3","3","За валом, к С от Татсунчелеевского городища.","300","100","30000",,"3",,"2","7","1","true","2","false","false","false","153",,"true","false",,"567","567","54.726080556","50.735802778"," 54° 43' 34"""," 50° 44' 9"""
"1183","232","Татсунчелеевское II","2","3","3","В 1,5 км к СЗ от с. Татсунчелеево, на краю коренного берега реки.","190","80","15200",,"3",,"2","7","1","false","2","false","false","false","153",,"true","false",,"568","568","54.729697222","50.713116667"," 54° 43' 47"""," 50° 42' 47"""
"1184","479","Татсунчелеевское III","2","3","3","В 1,5 км к СЗ от с. Татарское Сунчелеево, на краю надлуговой террасы. Селище разделено на две части (140x100 и 120x80) оврагом.","260","180","46800",,"4",,"2","7","8","false","2","false","false","false","153",,"true","false",,"569","569","54.725802778","50.719658333"," 54° 43' 33"""," 50° 43' 11"""
"1185","480","Татсунчелеевское IV","2","3","3","В 2 км к СЗ от  с. Татарское Сунчелеево (л.б.р. Б. Сульча), на мысу надлуговой террасы высотой в 6 м.","105","95","9975","60","2",,"2","3","1","false","2","false","false","false","153",,"true","false",,"570","570","54.723236111","50.698891667"," 54° 43' 24"""," 50° 41' 56"""
"1186","481","Татсунчелеевское V","2","3","3","В 3 км к СЗ от с. Татарское Сунчелеево, на мысу надлуговой террасы между рекой Б. Сульча при слиянии ее с р. М. Сульча, 4-5 м над уровнем поймы.","120","110","13200","60","3",,"2","3","6","false","2","false","false","false","153",,"true","false",,"571","571","54.725802778","50.690388889"," 54° 43' 33"""," 50° 41' 25"""
"1187","482","Татсунчелеевское VI","2","3","3","В 0,4 км к СВ от с. Татарское Сунчелеево, на СВ его окраине, около ферм, на краю надлуговой террасы.","200","140","28000",,"3",,"2","3","1","false","2","false","false","false","153",,"true","false",,"572","572","54.717427778","50.716452778"," 54° 43' 3"""," 50° 42' 59"""
"1188","411","Ташкирменьский","4","3","24","В 200 м к Ю от Ташкирменского городища, к С от Ташкирменьского I селища, в СВ части д. Макаровка, на правом берегу р. Меши.",,,,"45",,,"2","1","1","false","2","false","false","false","141",,"true","false",,"573","573","55.3139","49.386602778"," 55° 18' 50"""," 49° 23' 12"""
"1189","84","Ташкирменьское I","1","3","24","К Ю от с. Ташкирмень, через овраг, рядом с с. Макаровка. Площадка занимает СВ оконечность тупого мыса между правым берегом реки и ручьем, протекающим по оврагу.","62","55","2800","95","2",,"2","7","8","false","2","true","false","false","141","3","true","true",,"574","574","55.3154","49.386936111"," 55° 18' 55"""," 49° 23' 13"""
"1190","85","Ташкирменьское I","2","3","24","К ЮВ от Ташкирмеьского I городища.","135","45","6075","100","2",,"2","7","3","true","2","false","false","false","141",,"true","false",,"575","575","55.314383333","49.386966667"," 55° 18' 52"""," 49° 23' 13"""
"1191","86","Ташкирменьское II (Бишек-Тау)","1","3","24","К СЗ от Ташкирменьского I городища, на левом берегу оврага.","19","14","266","50","2",,"3","4","5","false","2","false","false","false","141","5","true","false",,"576","576","55.315797222","49.384297222"," 55° 18' 57"""," 49° 23' 3"""
"1192","87","Ташкирменьское II","2","3","24","К С от Ташкирменьского II городища, на краю надлуговой террасы.","50","30","1500",,"2",,"3","4","2","true","2","false","false","false","141",,"true","false",,"577","577","55.315880556","49.384169444"," 55° 18' 57"""," 49° 23' 3"""
"1193","92","Ташкирменьское III","3","3","24","Около с. Ташкирмень. [У П.Н. Старостина - Ташкирменьское местонахождение].",,,,,,,"6","1","1","false","2","false","false","false","141",,"true","false",,"578","578","55.317972222","49.385094444"," 55° 19' 5"""," 49° 23' 6"""
"1194","88","Ташкирменьское III","2","3","24","К ЮВ от с. Ташкирмень (пр.б.р. Меша) в направлении д. Епанчино, на небольшом возвышении останца надлуговой террасы, у СЗ края болота, в ур. Кур-Курас. Затоплено.","200","100","20000",,"3",,"5","3","1","false","2","false","false","false","141",,"true","false",,"579","579","55.304077778","49.392966667"," 55° 18' 15"""," 49° 23' 35"""
"1195","89","Ташкирменьское IV","2","3","24","К В от Ташкирмеьского I городища, на краю надлуговой террасы.",,,,"50",,,"2","3","11","false","2","false","false","false","141",,"true","false",,"580","580","55.315411111","49.388138889"," 55° 18' 55"""," 49° 23' 17"""
"1196","90","Ташкирменьское V","2","3","24","К С от Ташкирменьского I городища, на левом берегу оврага.","140","35","4900","30","2",,"3","3","2","false","2","false","false","false","141",,"true","false",,"581","581","55.316486111","49.386677778"," 55° 18' 59"""," 49° 23' 12"""
"1197","91","Ташкирменьское VI","2","3","24","К З от Ташкирменьского I  городища, на краю оврага.","95","35","3325",,"2",,"3","5","3","false","2","false","false","false","141",,"true","false",,"582","582","55.315105556","49.384875"," 55° 18' 54"""," 49° 23' 6"""
"1198","326","Ташлыкское I","2","3","30","В 1 км к ЮЗ от с. Ташлык (л.б.р. Камаевка, пр.пр.р. Зай), на краю надлуговой террасы. [У П.Н. Старостина - Ташлыкское III селище].",,,,,,,"2","3","1","false","4","false","false","false","136",,"true","false",,"583","583","55.492197222","51.788769444"," 55° 29' 32"""," 51° 47' 20"""
"1199","36","Теньковское (Гора Стеньки Разина)","1","3","22","В 400 м к С от с. Теньки (л.б.р. Мордовка, л.пр.р. Шарманка, пр.пр.р. Волги), на мысу между двумя оврагами.","80","35","2800",,"2",,"2","7","5","false","2","false","false","false","130","3","true","false","1809","584","584","55.444041667","48.965763889"," 55° 26' 39"""," 48° 57' 57"""
"1200","35","Теньковское","2","3","22","В 400 м к С от с. Теньки (л.б.р. Мордовка, л.пр.р. Шарманка, пр.пр.р. Волги) и в 20 м к В от городища.","150","80","12000","10","3",,"2","7","1","true","2","false","false","false","130",,"true","false","1808","585","585","55.447086111","48.986130556"," 55° 26' 50"""," 48° 59' 10"""
"1201","461","Тетюшское I","1","3","38","В С конце ул. Урицкого г. Тетюши, к Ю от Вшивой Горки.",,,"9700","115","2",,"2","7","5","false","2","false","false","false","149",,"true","false",,"586","586","54.942186111","48.845188889"," 54° 56' 32"""," 48° 50' 43"""
"1202","462","Тетюшское I","2","3","38","В 500 м к С от г. Тетюши (пр.б.р. Волги), на высокой террасе, изрезанной оврагами.","250",,,"125",,,"2","7","8","false","2","false","false","false","149",,"true","false",,"587","587","54.962227778","48.841272222"," 54° 57' 44"""," 48° 50' 29"""
"1203","13","Тетюшское II","1","3","38","На СВ окраине г. Тетюши, на мысу, образованном берегом Волги и оврагом, называемом ""Вшивая горка"".","120","25","2903","70","2",,"2","7","5","false","2","true","true","true","149","3","true","true","3201","588","588","54.943297222","48.845352778"," 54° 56' 36"""," 48° 50' 43"""
"1204","14","Тетюшское II","2","3","38","К Ю от Тетюшского II городища.",,,,"25",,,"2","7","1","true","2","false","false","false","149",,"true","false","3199","589","589","54.942477778","48.844225"," 54° 56' 33"""," 48° 50' 39"""
"1205","504","Тойгузинское I","2","3","28","В 4 км к ЮВ от с. Тойгузино (л.б.р. Ик), на краю верхней террасы.","75","40","3000","25","2",,"2","5","1","false","4","false","false","false","175",,"true","false",,"590","590","55.849461111","52.832825"," 55° 50' 58"""," 52° 49' 58"""
"1206","670","Торновое I","2","2","50","В 4 км к CВ от с. Торновое, на С берегу заболоченного старичного озера.","700","210","147000","70","8",,"5","4","4","false","2","true","false","false","174",,"true","true",,"591","591","53.277805556","50.015588889"," 53° 16' 40"""," 50° 0' 56"""
"1207","671","Торновое II","1","2","50","В 4 км к СВ от с. Торновое, к С от селища Торновое I.","55","50","2750","35","2",,"5","5","8","false","2","false","false","false","174",,"true","true",,"592","592","53.281191667","50.007605556"," 53° 16' 52"""," 50° 0' 27"""
"1208","672","Торновое II","2","2","50","В 2,5 км к ВСВ от с. Торновое, по З сторону от грутновой дороги от с. Рождествено к Жигулевским горам.
[У Дубмана-Мышкина - III Торновское селище].","300","120","36000","50","4",,"5","4","4","false","2","false","false","false","174",,"true","true",,"593","593","53.276225","49.999211111"," 53° 16' 34"""," 49° 59' 57"""
"1209","368","Троицко-Урайский","4","3","34","На территории Троицко-Урайского I селища.",,,,,,,"2","5","1","false","2","false","false","false","133",,"true","false",,"594","594","55.465636111","50.205030556"," 55° 27' 56"""," 50° 12' 18"""
"1210","110","Троицко-Урайское I (Широкая Гора)","1","3","34","В 2,5 км к ЗСЗ от с. Троицкий Урай (пр.б.р. Камы), на мысу между оврагами.
55,4639 50,2051
55,4628 50,2139","120","80","9600","35","2",,"2","5","5","false","2","true","true","true","133",,"true","true",,"595","595","55.463288889","50.205813889"," 55° 27' 48"""," 50° 12' 21"""
"1211","111","Троицко-Урайское I","2","3","34","К C, за валом Троицко-Урайского I  городища, на широкой площадке мыса. [У П.Н. Старостина - Троицко-Урайское селище].","150","140","21000",,"3",,"2","5","1","true","2","false","false","false","133",,"true","false",,"596","596","55.464841667","50.205888889"," 55° 27' 53"""," 50° 12' 21"""
"1212","112","Троицко-Урайское II","1","3","34","В 60-70 м к В от Троицко-Урайского I  городища, на узком мысу надлуговой террасы, между оврагами.
55,4634 50,2076
55,4631 50,2078
55,4626 50,2076
55,4631 50,2073","80","15","1200","30","2",,"2","1","5","false","2","false","false","false","133",,"true","true",,"597","597","55.4634","50.2076"," 55° 27' 48"""," 50° 12' 27"""
"1213","369","Троицко-Урайское II","2","3","34","У подножия Троицко-Урайского городища, на краю надлуговой террасы, подходящей к реке в виде тупого мыса.","160","150","24000",,"3",,"2","3","11","true","2","false","false","false","133",,"true","false",,"598","598","55.461972222","50.206402778"," 55° 27' 43"""," 50° 12' 23"""
"1214","370","Троицко-Урайское III","2","3","34","На мысу надлуговой террасы, под Троицко-Урайским II городищем. Площадка с З и В сторон ограничена овражками, с Ю - рекой.",,,,"20",,,"2","3","11","true","2","false","false","false","133",,"true","false",,"599","599","55.461936111","50.208377778"," 55° 27' 43"""," 50° 12' 30"""
"1215","325","Тубинское I","2","3","30","В 0,8—0,9 км к СВ  от с. Туба (л.б.р. Зай), на краю высокой террасы, на правом берегу р. Зай.","160","50","8000","8","2",,"2","7","3","false","3","false","false","false","136",,"true","false",,"600","600","55.476391667","51.764866667"," 55° 28' 35"""," 51° 45' 54"""
"1216","383","Тубинское II","2","3","30","В 0,8 км к ЮЮЗ от с. Туба, на краю террасы высотой 50 м.","160","150","24000",,"3",,"2","7","1","false","3","false","false","false","136",,"true","false",,"601","601","55.462563889","51.764969444"," 55° 27' 45"""," 51° 45' 54"""
"1217","168","Тюгульбаевское I","2","3","37","В 2 км к СВ от д. Тат-Тюгульбаево, на правом берегу р. Бездны, на краю надлуговой террасы [В Археологической карте Татарстана - Татарско-Тюгульбаевское].",,,,,,,"2","3","1","false","3","false","false","false","151",,"true","false",,"602","602","54.8237","49.65435"," 54° 49' 25"""," 49° 39' 16"""
"1218","169","Тюгульбаевское II","2","3","37","В 1 км к В от д. Русское Тюгульбаево, на правом берегу р. Бездны, на краю надлуговой террасы [В Археологической карте Татарстана - Русско-Тюгульбаевское I селище].",,,,,,,"2","3","1","false","3","false","false","false","151",,"true","false",,"603","603","54.808772222","49.669113889"," 54° 48' 32"""," 49° 40' 9"""
"1219","8","Тюкашинское","3","3","38","В 1,2 км к В от д. Тюкаши (пр.б.р. Волги), на мысу между берегом реки и оврагом.",,,,,,,"6","1","8","false","1","false","false","false","149",,"true","false","3205","604","604","54.670383333","48.594405556"," 54° 40' 13"""," 48° 35' 40"""
"1220","246","Тюрнясевское  I","2","3","32","В 0,8 км к С от с. Тюрнясево (л.б.р. Б. Сульча), на невысоком мысу надлуговой террасы.","200","100","20000",,"3",,"2","3","7","false","3","false","false","false","161",,"true","false",,"605","605","54.602627778","50.583688889"," 54° 36' 9"""," 50° 35' 1"""
"1221","247","Тюрнясевское II","2","3","32","В 0,6 км к С от центральной усадьбы совхоза ""Тюрнясевский"", на краю надлуговой террасы, подходящей к низине в виде невысокого мыса.","125","90","11250",,"3",,"2","3","7","false","3","false","false","false","161",,"true","false",,"606","606","54.60545","50.597658333"," 54° 36' 20"""," 50° 35' 52"""
"1222","501","Тюрнясевское II","3","3","32","В 0,2 км к СЗ от Тюрнясевского II селища.",,,,,,,"2","1","1","false","3","false","false","false","161",,"true","false",,"607","607","54.607825","50.596091667"," 54° 36' 28"""," 50° 35' 46"""
"1223","201","Тяжбердинское I","2","3","6","В 400 м к Ю от д. Тяжбердино, на З склоне оврага, в котором течет р. Красный Ахтай.",,,,,,,"2","6","1","false","3","false","false","false","151",,"true","false",,"608","608","54.850261111","49.923041667"," 54° 51' 1"""," 49° 55' 23"""
"1224","202","Тяжбердинское II","2","3","6","В 0,5 км к Ю от дер. Тяжбердино, на правом берегу оврага, в котором течет ручей Красный Ахтай.",,,,,,,"2","6","1","false","3","false","false","false","151",,"true","false",,"609","609","54.847294444","49.928363889"," 54° 50' 50"""," 49° 55' 42"""
"1225","425","У Пичкасского рыбопитомника","2","3","37","В 0,4 км к СВ от Пичкасского рыбопитомника, на мысу надлуговой террасы, между двумя оврагами.",,,,"45",,,"2","3","8","false","3","false","false","false","142",,"true","false",,"610","610","55.1257","49.536861111"," 55° 7' 33"""," 49° 32' 13"""
"1226","572","Ульяновск I","2","4","83","На Венце, против общежития УГПИ, на территории сквера и ниже, на мысу вдоль спуска к Волге.",,,,,,,"6","5","1","false","4","false","true","false","164",,"true","false",,"611","611","54.320658333","48.407916667"," 54° 19' 14"""," 48° 24' 29"""
"1227","554","Ульяновск II","2","4","83","На расстоянии около 1 км к СВ от 337 квартала г. Ульяновска (против стрельбища), на узком мысу, волжского коренного берега, плавно спускающемся к Куйбышевскому вдхр. и ограниченном с С оврагом.",,,"500",,"2",,"3","6","8","false","4","false","false","false","156",,"true","false",,"612","612","54.359652778","48.391858333"," 54° 21' 35"""," 48° 23' 31"""
"1228","243","Ульяновское I","2","3","41","В 0,3 км к СЗ от д. Ульяновки, на краю надлуговой террасы, 10-11 м над поймой.","70","50","3500",,"2",,"2","3","8","false","3","false","true","false","154",,"true","false",,"613","613","54.728236111","51.236308333"," 54° 43' 42"""," 51° 14' 11"""
"1229","244","Ульяновское II","2","3","41","В 0,2 км к С от д. Ульяновки (пр.б.р. Б. Сульча), на мысу коренной террасы правого берега реки, 8-9 м над поймой.","110","70","7700",,"2",,"2","3","1","false","3","false","false","false","154",,"true","false",,"614","614","54.731902778","51.244719444"," 54° 43' 55"""," 51° 14' 41"""
"1230","579","Уркина Гора","2","2","65","В небольшой долине у подножия Уркиной Горы, на правом берегу р. Усы, недалеко от ее устья, близ д. Жигулиха. От реки с З на В площадку пересекают небольшие, но глубокие овраги.","200","150","30000",,"3",,"2","1","1","false","1","false","false","false","1",,"true","false",,"615","615",,,,
"1231","144","Урнякское","1","3","90","В 2 км к СЗ от с. Урняк,  на левом берегу Волги. На высоком мысу между оврагами, в урочище ""Городок"".",,,"1250",,"2",,"3","5","5","false","4","false","false","false","149",,"true","false",,"616","616","54.918161111","48.932780556"," 54° 55' 5"""," 48° 55' 58"""
"1232","300","Урнякское I","2","3","32","В 1,2 км к З от д. Урняк (л.б.р. Б. Черемшан), на мысу между краем террасы и двумя оврагами, вытянутыми с С на Ю.","200","175","35000","20","4",,"2","3","8","false","3","false","false","false","161",,"true","false",,"617","617","54.583877778","50.814813889"," 54° 35' 2"""," 50° 48' 53"""
"1233","301","Урнякское II","2","3","32","В 0,1 км к З от д. Урняк, в 100 м к В от пасеки, на краю надлуговой террасы.","300","150","45000","40","4",,"2","3","3","false","3","false","false","false","161",,"true","false",,"618","618","54.583252778","50.824397222"," 54° 34' 60"""," 50° 49' 28"""
"1234","302","Урнякское III","2","3","32","В 1 км к В от д. Урняк, в 3,5 км к СЗ от с. Курманаево, на мысу, образованном надлуговой террасой реки и неглубокой ложбинкой. Азимут на мечеть с. Курманаево - 130 град.","300","200","60000","40","5",,"2","3","3","false","3","false","false","false","161",,"true","false",,"619","619","54.586288889","50.847463889"," 54° 35' 11"""," 50° 50' 51"""
"1235","673","Усинское I","2","2","50","За С окраиной п. Карлинский, на краю первой надпойменной террасы.","300","70","21000","45","3",,"5","3","3","false","3","false","false","false","174",,"true","true",,"620","620","53.250775","50.082738889"," 53° 15' 3"""," 50° 4' 58"""
"1236","674","Усинское III","2","2","50","В 180 м к С от п. Усинский, на краю надпойменной террасы.","125","100","12500","30","3",,"5","3","8","false","3","false","false","false","174",,"true","true",,"621","621","53.258966667","50.086516667"," 53° 15' 32"""," 50° 5' 11"""
"1237","622","Услада","3","2","65","В 800 м к З от ж/д разъезда ""Услада"" и шоссе М5, в 700 м к ССЗ от электроподстанции, на краю заросшего лесом оврага.",,,,,,,"3","6","10","false","3","false","false","false","172",,"true","false",,"622","622","53.267311111","49.252197222"," 53° 16' 2"""," 49° 15' 8"""
