"IDMonument","MonNumber","MonName","IDMonType","IDState","IDRegion","MonDescription","MonLength","MonWide","MonSquare","MonLayer","IDSquareType","IDSoilType","IDWaterType","IDRiverReliefType","IDLocalReliefForm","MonDateToTheFort","IDArrangementType","FerrousMetallurgy","NonferrousMetallurgy","Agriculture","IDMapNumber","IDCurrentState","Active","Location Specified","MonTatarCodeNumber","IDMonCultureBelonging","AnotherCultureLayers","MonDecimalLatitude","MonDecimalLongitude","MonLatitude","MonLongitude"
"616","441","Азеевское III","3","3","31","В 4 км к СВ от с. Азеево, у края террасы.",,,,,,,"2","3","1","false","3","false","false","false","123",,"true","false",,"1","1","55.234130556","51.143083333"," 55° 14' 3"""," 51° 8' 35"""
"617","449","Акташское I","2","3","7","Напротив средней части с. Акташ, на краю надлуговой террасы правого берега р. Зай, в 2 км к ЮЮВ от д. Зай-Чишма, напротив изгиба ЛЭП, идущей вдоль террасы.","150","50","7500","40","2",,"2","3","3","false","3","false","false","false","146",,"true","false",,"2","2","55.041763889","52.145172222"," 55° 2' 30"""," 52° 8' 43"""
"618","450","Акташское II","2","3","7","В 300 м к ССЗ от Акташского I поселения, на склоне надлуговой террасы.","100","60","6000",,"2",,"2","3","3","false","3","false","false","false","146",,"true","false",,"3","3","55.044019444","52.145125"," 55° 2' 38"""," 52° 8' 42"""
"619","561","Алексеевка I","2","4","75","К З от затопленного с. Алексеевка (2 км к З от современной деревни того же наименования, 14 км к ЗСЗ от п. Мирный), на возвышении между оврагами. Затоплено.",,,,"20",,,"6","4","1","false","4","false","false","false","157",,"true","false",,"4","4","54.398791667","48.535558333"," 54° 23' 56"""," 48° 32' 8"""
"620","371","Алексеевское X","2","3","5","В 5,8 км к СЗ от п. Алексеевский, на краю разрушенной надлуговой террасы.","100","30","3000",,"2",,"2","3","3","false","4","false","false","false","133",,"true","false",,"5","5","55.347197222","50.017986111"," 55° 20' 50"""," 50° 1' 5"""
"621","573","Андреевка I","2","4","75","В 2 км к. ЗC3 от с. Андреевка, на удалении 100 м к ЮВ от Андреевского городища, на высокой террасе, между двумя оврагами.","650","120","78000",,"6",,"3","5","5","false","4","false","false","false","165",,"true","false",,"6","6","54.164413889","48.793655556"," 54° 9' 52"""," 48° 47' 37"""
"622","442","Андреевское Iа","2","3","31","На В окраине д. Андреевка, к В от фермы, на краю надлуговой террасы.","250","210","52500",,"5",,"2","3","3","false","3","false","false","false","145",,"true","false",,"7","7","55.032538889","51.428888889"," 55° 1' 57"""," 51° 25' 44"""
"623","443","Андреевское II","2","3","31","На В окраине д. Андреевка, в 200 м к В от Андреевского I селища (болг.), которое находится на З окраине д. Андреевка, справа от дорого в п. Аверьяновка.","370","140","51800",,"5",,"2","3","3","false","3","false","false","false","145",,"true","false","2341","8","8","55.034233333","51.417816667"," 55° 2' 3"""," 51° 25' 4"""
"624","164","Антоновское","2","3","37","В 0,5 км к В от с. Антоновка, на правом берегу р. Бездны, на краю надлуговой террасы.",,,,,,,"2","3","1","false","4","false","false","false","151",,"true","false","2752","9","9","54.915336111","49.528575"," 54° 54' 55"""," 49° 31' 43"""
"626","316","Архангельское I","2","3","31","В 3,4—3,5 км к Ю от с. Слобода Архангельская, на низком подчетырехугольном мысу надлуговой террасы, образованном двумя оврагами с С и Ю сторон [В Археологической карте Татарстана ""Центральное Закамье"" - Архангельское II селище].","120","100","12000","20","3",,"2","7","5","false","3","false","false","false","145",,"true","false","2345","11","11","55.127658333","51.250716667"," 55° 7' 40"""," 51° 15' 3"""
"627","317","Архангельское II","2","3","31","В 1,7 км к ЮЮЗ от Ю конца с. Слобода Архангельская, на склоне надлуговой террасы, с СВ и Ю ограничено оврагами.
[В археологической карте Татарстана ""Центральное Закамье"" и у П.Н. Старостина - Архангельское III селище].","150","70","10500","17","3",,"2","3","8","false","3","false","false","false","145",,"true","false","2346","12","12","55.140058333","51.257925"," 55° 8' 24"""," 51° 15' 29"""
"628","318","Архангельское III","3","3","31","В 3,2—3,3 км к СВ от с. Слобода Архангельская, на краю надлуговой террасы.",,,,,,,"2","3","1","false","1","false","false","false","145",,"true","false","2342","13","13","55.184405556","51.297188889"," 55° 11' 4"""," 51° 17' 50"""
"629","319","Архангельское V","3","3","31","В 4 км к Ю от с. Слобода Архангельская (пр.б.р. Шешма), на краю надлуговой террасы.",,,,,,,"2","3","1","false","1","false","false","false","145",,"true","false",,"14","14","55.122744444","51.246883333"," 55° 7' 22"""," 51° 14' 49"""
"630","458","Арчиловское I","2","3","90","На окраине быв. с. Арчиловка, к ЮВ от Полянского II (Арчиловского II) селища, на краю верхней террасы между двух оврагов.","100","100","10000","95","2",,"2","5","8","false","2","false","false","false","149",,"true","false",,"15","15","54.819933333","48.988588889"," 54° 49' 12"""," 48° 59' 19"""
"631","623","Аскулы I","2","2","65","На Ю окраине с.Аскулы, на широком мысу между отрогами восточной ветви Аскульского оврага.",,,"40000",,"4",,"3","6","5","false","4","false","false","false","173",,"true","false",,"16","16","53.273363889","49.616461111"," 53° 16' 24"""," 49° 36' 59"""
"632","519","Ашна-Пандовское","1","4","77","На гряде Ашна-Панда, в ур. Кладовая Гора, в 300-400 м от русла, посередине между дд. Гулюшево и Кирзять, близ п. Совхозный, на левом берегу руч. Ашна, левого притока Суры. [В отчете П.Д. Степанова 1946 г. - городище Казна-Пандо (Налитовское).]
Находится на сложенной мелом гряде Ашна-Пандо, составляющей левый коренной берег руч. Ашна (левого притока Суры), в 300-400 м от русла, посередине между дд. Гулюшево и Кирзять, удаленными друг от друга на 10 км (близ п.Совхозный). К городищу подходит лесная проселочная дорога. Памятник занимает ур. Кладовая Гора - узкий и длинный мыс, более резко, чем соседние, вдающийся в долину; тянется он к Ю с уклоном к З, Мыс на десятки метров возвышается над долиной, а склоны его круты. С напольной стороны городищенская площадка
защищена системой их трех рвов и валов. Первый (южный) вал снабжен проходом, продолжением которого служит канавка на южном склоне рва, направленная к восточному краю мыса. Гребень вала возвышается над дном рва приблизительно на 6 м. Остальные валы и рвы значительно уступают первой линии укреплений по высоте, глубине и ширине. За валами - селище.
Площадка городища, покрытая лиственным лесом, имеет длину около 100 м при ширине порядка 50 м. Восточный участок ее занят вытянутым меридионально зигзагообразным раскопом площадью около 400 кв. м. У ее северо-западного и юго-западного краев нами заложены шурфы. Будучи недоступным для трактора и плуга, городище находится в хорошем состоянии, и лишь на южном конце имеется округлая, по-видимому, кладоискательская яма расплывчатого профиля. Повсеместно выражен культурный слой мощностью 0,5 м и более, насыщенный керамикой именьковского времени и костями животных. В небольшом количестве на городище найден и более ранний материал, встречающийся обычно в нижнем горизонте культурного слоя. Это - фатьяновский комплекс, представленный по краю площадки, и вещи I тысячелетия до н.э.","100","50","5000","50","2",,"2","5","5","false","2","true","false","true","118",,"true","true",,"17","17","54.417419444","46.633519444"," 54° 25' 3"""," 46° 38' 1"""
"633","520","Ашна-Пандовское","2","4","77","За валом Ашна-Пандовского городища.",,,,,,,"2","5","1","true","2","false","false","false","118",,"true","false",,"18","18","54.420880556","46.636783333"," 54° 25' 15"""," 46° 38' 12"""
"634","145","Бабий Бугор","1","3","37","В СЗ части Булгарского городища, на небольшом (длина ок. 30 м) мысу левого коренного берега р. Волги.",,,,"30",,,"5","5","7","false","2","false","false","false","150",,"true","false","2755","19","19","54.987108333","49.043613889"," 54° 59' 14"""," 49° 2' 37"""
"635","430","Бабий Бугор","2","3","37","На территории Болгарского городища, к В от Бабьего бугра, зафиксировано в раскопе 47 1957 г.",,,,,,,"5","5","1","false","2","false","false","false","150",,"true","false",,"20","20","54.986530556","49.043366667"," 54° 59' 12"""," 49° 2' 36"""
"636","582","Баганинское","2","2","69","В 250 м к С от З края с. Красная Багана, на правом берегу р. Б.Черемшан.","180","60","10800",,"3",,"2","5","3","false","3","false","false","false","162",,"true","false",,"21","21","54.626583333","51.211977778"," 54° 37' 36"""," 51° 12' 43"""
"637","282","Баганское","2","2","69","В 1,2 км к З от с. Красная Багана, по обе стороны оврага, образованного ручьем, впадающем в р. Б.Черемшан. [У Р.Г. Фахрутдинова - I и II местонахождения.]","300","60","18000",,"3",,"2","3","8","false","3","false","false","false","162",,"true","false",,"22","22","54.620072222","51.189147222"," 54° 37' 12"""," 51° 11' 21"""
"638","198","Базарноматакское I","2","3","6","В 2,5 км к СВ от с. Базарные Матаки, по дороге на с. Старые Челны, к З от моста через р. Ахтай, на левом берегу.","200","150","30000",,"3",,"2","3","1","false","3","false","false","false","151",,"true","false","894","23","23","54.935011111","49.957869444"," 54° 56' 6"""," 49° 57' 28"""
"639","199","Базарноматакское II","2","3","6","В 2,9 км к С от с. Базарные Матаки, в 0,4 км вниз по течению р. Ахтай от Базарноматакского I селища, на левом берегу р. Ахтай.",,,,,,,"2","3","1","false","3","false","false","false","151",,"true","false","895","24","24","54.938327778","49.952591667"," 54° 56' 18"""," 49° 57' 9"""
"640","187","Базяковское","2","3","5","В 800 м к СЗ от с. Базяково, у извилины правого берега р. Ахтай.","650",,,"75",,,"2","3","3","false","3","false","false","false","142",,"true","false","491","25","25","55.143913889","49.716119444"," 55° 8' 38"""," 49° 42' 58"""
"641","216","Байтеряковское I","2","3","42","В 400 м к С от д. Байтеряково, на правом берегу речки Бахты, правого притока р. Шенталы, на мысу надлуговой террасы, образованном берегом реки с Ю и оврагом с С. Поверхность мыса всхолмленная.","200","90","18000","40","3",,"2","3","8","false","3","false","false","false","133",,"true","false","3324","26","26","55.3648","50.3706"," 55° 21' 53"""," 50° 22' 14"""
"642","217","Байтеряковское III","2","3","42","В 1,5 км к ЮВ от д. Байтеряково, на правом берегу реки Бахты, на краю надлуговой террасы, возвышающемся на 7 м над уровнем реки.","450","110","49500","25","4",,"2","3","3","false","3","false","false","false","133",,"true","false","3326","27","27","55.3428","50.3759"," 55° 20' 34"""," 50° 22' 33"""
"643","218","Байтеряковское IV","2","3","42","В 2,5 км к ЮЮВ от д. Байтеряково, на правом берегу речки Бахты, на склоне надлуговой террасы, поднимающемся над уровнем лугов на 6-7 м.","255","130","33150","50","4",,"2","3","3","false","3","false","false","false","133",,"true","false","3327","28","28","55.337","50.3773"," 55° 20' 13"""," 50° 22' 38"""
"644","355","Байчугинское","4","3","24","В 100 м к Ю от Байчугинского I селища, на размытом краю надлуговой террасы. Затоплено.",,,,,,,"2","3","1","false","3","false","false","false","131",,"true","false",,"29","29","55.337736111","49.45105"," 55° 20' 16"""," 49° 27' 4"""
"645","356","Байчугинское I","2","3","24","Расположен к СВ от с. Ташкирмень, в 1,5 км к В от б.д. Байчуга, на краю надлуговой террасы. Затоплено.","50","20","1000","50","2",,"2","3","1","false","3","false","false","false","131",,"true","false","1839","30","30","55.339030556","49.449288889"," 55° 20' 21"""," 49° 26' 57"""
"646","357","Байчугинское II","2","3","24","В 0,3 км к С от Байчугинского I селища, в 1,6 км к ВСВ от б.д. Байчуга, на краю надлуговой террасы. Затоплено.","105","20","2100",,"2",,"2","3","3","false","3","false","false","false","131",,"true","false",,"31","31","55.341152778","49.447530556"," 55° 20' 28"""," 49° 26' 51"""
"647","136","Балымерское I","2","3","90","Непосредственно за валом и рвом, к СВ от Балымерского Шолома, на левом берегу Волги. На краю коренного берега.","60","50","3000","80","2",,"2","7","2","true","2","false","false","false","149",,"true","false","2760","32","32","54.8518","48.9579"," 54° 51' 6"""," 48° 57' 28"""
"648","143","Балымерское II (Турецкая Крепость)","1","3","90","В З км к северу от д. Балымеры, на левом берегу Филиппова оврага, левого притока Волги. В удалении от реки, на мысу треугольной формы.","60","35","2100","5","2",,"3","5","8","false","4","false","false","false","149",,"true","false","2758","33","33","54.890072222","48.941797222"," 54° 53' 24"""," 48° 56' 30"""
"649","137","Балымерское II","2","3","90","На ЮВ окраине д. Балымеры, в 300 м к ЮВ от Балымерского Шолома, на краю надлуговой террасы левого берега р. Волги, по левую сторону оврага.","250","140","35000","40","4",,"2","7","3","false","2","false","false","false","149",,"true","false","2761","34","34","54.84765","48.969486111"," 54° 50' 52"""," 48° 58' 10"""
"650","138","Балымерское III","2","3","90","На ЮВ окраине д. Балымеры, в 400 м к ЮВ от Балымерского Шолома,  на краю надлуговой террасы левого берега р. Волга, на месте Балымерского I городища.","80","70","5600",,"2",,"2","7","3","false","2","false","false","false","149",,"true","false","2762","35","35","54.8467","48.9636"," 54° 50' 48"""," 48° 57' 49"""
"651","139","Балымерское IV","2","3","90","В 100 м к ЮВ от Ю конца д. Балымеры, на левом берегу Волги. На левом берегу оврага у Ю конца села, в 100 м к З от Балымерского городища, на краю коренного берега.","120","60","7200","120","2",,"2","7","3","false","2","false","false","false","149",,"true","false","2763","36","36","54.846291667","48.966783333"," 54° 50' 47"""," 48° 58' 0"""
"652","140","Балымерское V","2","3","90","В 1—0,8 км к ЮВ от с. Балымеры, на левом берегу Волги. На краю надпойменной террасы левого берега р. Волги, за валом Балымерского I городища, в 400 м от него.","100","60","6000","90","2",,"2","7","3","false","2","false","false","false","149",,"true","false","2764","37","37","54.846711111","48.972758333"," 54° 50' 48"""," 48° 58' 22"""
"653","135","Балымерское городище Шолом","1","3","90","В c. Балымеры, на мысу коренного берега между оврагами на левом берегу Волги. Ныне почти полностью разрушено.",,,,,,,"2","7","5","false","2","false","true","true","149",,"true","false","2759","38","38","54.8498","48.9603"," 54° 50' 59"""," 48° 57' 37"""
"654","81","Баргузинское","2","3","22","В 1,5 км к Ю от с. Баргузино (пр.б.р. Амгамка), между оврагом ""Ак-Шура"" и берегом речки.","500","300","150000",,"8",,"3","1","1","false","4","false","false","false","141",,"true","false","1747","39","39","55.206586111","49.039019444"," 55° 12' 24"""," 49° 2' 20"""
"655","344","Батраковское","2","3","39","В 3 км к СЗ от д. Батраково, на склоне надлуговой террасы.","240","120","28800","40","3",,"6","5","3","false","4","false","false","false","126",,"true","false","3219","40","40","55.815902778","52.656011111"," 55° 48' 57"""," 52° 39' 22"""
"656","596","Бахиловское","2","2","65","В 1,5 км к З от с. Бахилово, в 3,6 км к В от г. Жигулевск, на пологом Ю склоне Бахиловского оврага. С З на В селище пересекает дорога Жигулевск - Бахилово.","240","180",,,,,"3","6","11","false","4","false","false","false","169",,"true","true",,"41","41","53.397777778","49.599030556"," 53° 23' 52"""," 49° 35' 57"""
"657","598","Белая Гора","1","2","50","В 1,5 к С от с. Подгоры, на площадке верхней части склона мысообразно выступающего отрога Жигулевских гор, носящего местное название ""Белая Гора"".","80","110","8800","15","2",,"5","5","8","false","2","false","false","false","170",,"true","true",,"42","42","53.343805556","50.119405556"," 53° 20' 38"""," 50° 7' 10"""
"658","540","Беловодское","1","4","78","В 1,5 км к В от с. Беловодье, в сторону от р. Суры, на одном из мысов коренного берега (имеющем мордовское название Ош-Пандо), более длинном и узком, чем соседние. Мыс длиной около 1 км тянется дугой с СВ на З и подходит к огибающему его с Ю и З ручью. Вдоль С края городища тянется дорога из Беловодья в Карсун. Большая часть мыса представляет собой заостренный хребет высотой в несколько десятков метров и лишь на конце выражена площадка длиной 100 м при ширине до 30 м. С напольной стороны она защищена рвом длиной 15 м, глубиной 4-5 м и коротким курганообразным валом. Как показала щурфовка, на площадке сохранился культурный слой мощностью до полуметра; это - сероватая супесь со щебнем, подстилаемая меловой скалой. Ввиду неприступности, городище распашке не подвергалось. На южном краю площадки, где весной интенсивно тает снег, встречается подъемный материал - керамика и кости животных.","100","30","3000","50","2",,"3","5","5","false","2","false","false","false","121",,"true","true",,"43","43","54.250372222","46.638427778"," 54° 15' 1"""," 46° 38' 18"""
"659","541","Беловодское","2","4","78","В 800 м к СВ от рва Беловодского городища, на треугольной площадке, ограниченной с двух сторон оврагами. При напольном (восточном) конце городищенского мыса, на расстоянии 800 м к СВ от рва, на треугольной площадке, ограниченной с двух сторон оврагами, обнаружен подъемный материал, сходный с тем, который встречается на городище. К настоящему времени культурный слой здесь частично разрушен бульдозером. Зона распространения подъемного материала имеет в поперечнике 20 м.",,,,,,,"3","5","5","false","2","false","false","false","121",,"true","false",,"44","44","54.255341667","46.646452778"," 54° 15' 19"""," 46° 38' 47"""
"660","258","Белозерское","2","3","6","Против Ю конца п. Белозерский, на краю надлуговой террасы.","200","100","20000",,"3",,"2","3","1","false","4","false","false","false","160",,"true","false",,"45","45","54.519891667","50.001069444"," 54° 31' 12"""," 50° 0' 4"""
"661","521","Белый Ключ","2","4","77","В 1 км к З от с. Белый Ключ, на краю надлуговой террасы, в 150 м к Ю от шоссе Ульяновск - Саранск.","65","60","3900",,"2",,"5","3","2","false","3","false","false","false","118",,"true","false",,"46","46","54.438886111","46.7927"," 54° 26' 20"""," 46° 47' 34"""
"662","584","Беляев Колодец","2","2","65","У верховьев Жукова и Точильного оврагов, в 100 м к ЮЗ от шоссе Жигули - Валы.",,,"1500",,"2",,"3","6","10","false","3","false","false","false","168",,"true","true",,"47","47","53.346519444","49.346558333"," 53° 20' 47"""," 49° 20' 48"""
"663","414","Березовогривский VI","4","3","5","В 2 км к ЗЮЗ от с. Березовая Грива, на песчаном останце ""Лисий остров"" надлуговой террасы л.б.р. Камы.",,,,,,,"2","3","7","false","2","false","false","false","142",,"true","false","561","48","48","55.200072222","49.717705556"," 55° 12' 0"""," 49° 43' 4"""
